Post;Url;Last tweet date;Nugget 1;Nugget 1 tweet date;Nugget 2;Nugget 2 tweet date;Nugget 3;Nugget 3 tweet date;Nugget 4;Nugget 4 tweet date;Nugget 5;Nugget 5 tweet date;Nugget 6 ;Nugget 6 tweet date;Nugget 7;Nugget 7 tweet date;Nugget 8;Nugget 8 tweet date;Nugget 9;Nugget 9 tweet date;;;;;;
How we used the improvement kata to gain 25% of productivity - Part 5;https://philippe.bourgau.net/how-we-used-the-improvement-kata-to-gain-25-percent-of-productivity-part-5/;08/11/2019;"From Peopleware: "" #Quality is Free, but only for those willing to pay for it!"" We reached the same conclusion ""How we used the #improvementkata to gain 25% of productivity - Part 5"" https://buff.ly/2EZvz7O #LeanManagement #softwaredevelopment";15/03/2019;"The #improvementKata not only brings improvement it also teaches you why they work! Read our story in ""How we used the improvement kata to gain 25% of productivity"" https://buff.ly/33sdRVw #ContinuousImprovement #Lean #Agile";8/11/19;;;;;;;;;;;;;;;;;;;;
Lessons learned from running our first improvement kata;https://philippe.bourgau.net/lessons-learned-from-running-our-first-improvement-kata/;01/04/2019;"We can reduce meeting time by mixing #retrospective & #improvementKata. This is one of the ""Lessons learned from running our first improvement kata"" https://buff.ly/2UWiaDX #LeanManagement #Agile #Scrum";01/04/2019;What are we waiting to apply data science to the development process ?;5/6/18;;;;;;;;;;;;;;;;;;;;
How to run your first improvement kata;https://philippe.bourgau.net/how-to-run-your-first-improvement-kata/;23/04/2019;The improvement kata is 100% scientific, it uses data and deduction, not gut feeling and best practices;23/07/2018;"We can learn anything on our own by just doing it! This is one of our takeaways from ""How to run your first #improvementKata"" https://buff.ly/2IrmjgS #Lean #Learning";23/04/2019;;;;;;;;;;;;;;;;;;;;
What Rails teaches us about building platforms and frameworks;https://philippe.bourgau.net/what-rails-teaches-us-about-building-platforms-and-frameworks/;09/04/2019;Once you have paying customers, you've got money to fuel further work.;19/12/2017;Thanks to agile practices, the cheapest way to build a framework is to extract it from a specific app.;22/11/2017;"#Rails started as part of a successful commercial app, only later was it made ""generic"" and #opensource. ""What Rails teaches us about building platforms and frameworks"" https://buff.ly/2HYwzNk #Software #IncrementalDesign";9/4/19;;;;;;;;;;;;;;;;;;
Mobbing around the world for 48h ... who's in ?;https://philippe.bourgau.net/mobbing-around-the-world-for-48h-dot-dot-dot-whos-in/;05/03/2018;Mob programming reduces WIP and cycle time;24/11/2017;Stupid ideas that work become great ideas.;05/03/18;;;;;;;;;;;;;;;;;;;;
Are Software Developers Overworked or Undecided ?;https://philippe.bourgau.net/are-software-developers-overworked-or-undecided/;21/10/2019;"""Principles​ ​of​ ​Product​ ​Development​ ​Flow"" by @DReinertsen should be a mandatory read for anyone involved with writing #software  #lean #agile https://buff.ly/2I13nRS";05/10/2018;"@Godin_Quotes: ""You don't need more time, you just need to decide!"" The question is: Are #Software Developers Overworked or Undecided? https://buff.ly/2VTrb1T #lean";21/10/2019;Stop starting and start finishing;30/3/18;;;;;;;;;;;;;;;;;;
Sustainable productivity in eXtreme Programming;https://philippe.bourgau.net/sustainable-productivity-in-extreme-programming/;12/03/2019;"A simple #planningGame will give room for #slack. ""Sustainable productivity in #eXtremeProgramming"" https://buff.ly/2Ca1l12 #SustainablePace #Scrum";12/03/2019;With time and efforts, developers can become domain experts !;20/7/2018;;;;;;;;;;;;;;;;;;;;
Why and how to start a #ZeroBugs policy - part 1;https://philippe.bourgau.net/why-and-how-to-start-a-number-zerobugs-policy-part-1/;18/11/2019;Exploratory testing goes hand in hand with #ZeroBugs policy;04/09/2018;"Some #eXtremeProgramming teams reported bug rates as low as 1.5 per month! Learn ""Why and how to start a #ZeroBugs policy"" https://buff.ly/33ThFiE";18/11/19;If you liked my series about #zerobugs, here is another complementary article about the topic https://buff.ly/2E7X7aa;29/01/18;;;;;;;;;;;;;;;;;;
Why and how to start a #ZeroBugs policy - part 2;https://philippe.bourgau.net/why-and-how-to-start-a-number-zerobugs-policy-part-2/;26/02/2019;#ZeroBugs policy makes developers happier;26/02/2019;#ZeroBugs policy reduces technical debt;16/5/18;;;;;;;;;;;;;;;;;;;;
Why and how to start a #ZeroBugs policy - part 3;https://philippe.bourgau.net/why-and-how-to-start-a-number-zerobugs-policy-part-3/;20/04/2020;"""Agreeing on rules for categorizing bugs with users streamlines flow"". Read more in ""Why and how to start a #ZeroBugs policy"" https://buff.ly/2JbeJ9D #softwaredevelopment ";10/05/2019;"#ExploratoryTesting gives you a quantifiable measure of your workflow. Read how we used it to reach a #ZeroBugs policy https://bit.ly/3anSpDE
";20/4/20;;;;;;;;;;;;;;;;;;;;
Why and how to start a #ZeroBugs policy - part 4;https://philippe.bourgau.net/why-and-how-to-start-a-number-zerobugs-policy-part-4/;28/06/2019;#ZeroBugs policy makes work more sustainable;02/04/2018;"Change agent's advice # 1 : be nice with people #changeManagement. Full story in ""Why and how to start a #ZeroBugs policy"" https://buff.ly/2Tk9kyE";28/6/19;#ZeroBugs policy makes #developers happy by losing less time and spending more time doing valuable stuff https://buff.ly/2Tk9kyE;7/1/19;;;;;;;;;;;;;;;;;;
Why Agile transformations usually don't work - part 1 - The situation;https://philippe.bourgau.net/why-agile-transformations-usually-dont-work-part-1-the-situation/;15/10/2019;#Agile can easily slip into micro-management... Unfortunately, Agile transformations usually don’t work! Read why here https://buff.ly/2Oz2N4b;15/10/2019;Competitors managed to copy Toyota's practices, but not their results !;28/1/19;;;;;;;;;;;;;;;;;;;;
Why Agile transformations usually don't work - part 2 - The problem;https://philippe.bourgau.net/why-agile-transformations-usually-dont-work-part-2-the-problem/;18/06/2019;"People buy-in values, but they measure them through actions. Full story in ""Why #Agile transformations usually don’t work""  https://buff.ly/2X6ftEl #AgileTranformation";18/06/2019;Maria Montessori said “Never help a child with a task at which he feels he can succeed.” The same applies to teams of adults in an #agile transformation ... https://buff.ly/2vBwNED;28/9/18;;;;;;;;;;;;;;;;;;;;
Why Agile transformations usually don't work - part 3 - What to do;https://philippe.bourgau.net/why-agile-transformations-usually-dont-work-part-3-what-to-do/;04/06/2019;An organization cannot be agile if all decisions have to go up and down the management ladder.;10/09/2018;"Encouraging #experimentation while sticking to compensation by objectives is schizophrenic. Read more in ""Why #Agile transformations usually don’t work"" https://buff.ly/2MgKstd";4/6/19;;;;;;;;;;;;;;;;;;;;
Why Agile transformations usually don't work - part 4 - Transparency;https://philippe.bourgau.net/why-agile-transformations-usually-dont-work-part-4-transparency/;08/07/2019;OKRs have nothing to do with compensation !;12/02/2018;"#SelfOrganization cannot work without a clear and compelling mission. Read more about #Transparency in ""Why #Agile transformations usually don’t work - part 4"" https://buff.ly/2TqcHnJ";8/7/19;#OKRs are what #ManagementByObjectives was meant to be https://buff.ly/2TqcHnJ #agile #lean ;8/1/19;;;;;;;;;;;;;;;;;;
Reducing the risks of large organization changes with the Mikado Method - part 1;https://philippe.bourgau.net/reducing-the-risks-of-large-organization-changes-with-the-mikado-method-part-1/;15/11/2019;By never changing the code, programmers make it even harder to change;20/04/2018;Large scale #Agile transformations are too often stressful for everyone ...  It turns out we can reduce the risks of large organization changes with the #MikadoMethod https://buff.ly/2Oi2clJ #lean #ImprovementKata;15/11/19;;;;;;;;;;;;;;;;;;;;
Reducing the risks of large organization changes with the Mikado Method - part 2;https://philippe.bourgau.net/reducing-the-risks-of-large-organization-changes-with-the-mikado-method-part-2/;08/04/2019;Developers can pause a Mikado Method refactoring for a while if needed.;26/06/2018;"The #MikadoMethod and the #ImprovementKata are more than similar. They are both system change techniques. Read more in ""Reducing the risks of large organization changes with the Mikado Method"" https://buff.ly/2OOz19w #Systems ";8/4/19;;;;;;;;;;;;;;;;;;;;
Reducing the risks of large organization changes with the Mikado Method - part 3;https://philippe.bourgau.net/reducing-the-risks-of-large-organization-changes-with-the-mikado-method-part-3/;16/10/2018;"Transforming large organization with the Mikado Method shows a ""right to fail"" mindset.";10/04/2018;Transforming large organization with the Mikado Method helps to parallelize work.;16/10/18;;;;;;;;;;;;;;;;;;;;
Why you should start a team coding dojo Randori right now;https://philippe.bourgau.net/why-you-should-start-a-team-coding-dojo-randori-right-now/;20/02/2020;Team Coding Dojo Randori are great at defining coding conventions.;16/07/2018;"#CodingDojo Randoris are a great lesson in #EgolessProgramming. Read ""Why you should start a team coding dojo Randori right now"" https://buff.ly/2FanQVK #unitTesting #TDD #MobProgramming";18/3/19;"I'm currently writing a post about how to define #codingStandards and conventions. Meanwhile, you can read ""Why you should start a team #codingDojo Randori right now"" and start defining yours right now! https://buff.ly/38EPeay";20/2/20;;;;;;;;;;;;;;;;;;
How to start a team coding dojo Randori today;https://philippe.bourgau.net/how-to-start-a-team-coding-dojo-randori-today/;03/06/2019;"As a first team Randori #codingdojo problem, I like Roman Numerals kata. Wondering ""How to start a team coding dojo Randori today"" https://buff.ly/2EI1MRD #TDD";03/06/2019;Team Randori coding dojo demonstrates agile principles in practice (focus on outcome, incremental delivery, YAGNI ...);11/9/18;;;;;;;;;;;;;;;;;;;;
Coding Dojo Troubleshooting;https://philippe.bourgau.net/coding-dojo-troubleshooting/;09/12/2019;"If you cannot get people to adopt a new practice, get them to try it once. You'll be more than halfway there. Read more tricks in ""Coding Dojo Troubleshooting"" #CodingDojo #ChangeManagement https://buff.ly/2rjoXOu";09/12/2019;"Reframe the #CodingDojo as a learning exercise relying on #TDD to go beyond skepticism. Find more tricks in ""Coding Dojo Troubleshooting"" https://buff.ly/2P0YHjD #IncrementalDesign #Refactoring";16/4/19;;;;;;;;;;;;;;;;;;;;
How to get the max out of your Team Coding Dojo ?;https://philippe.bourgau.net/how-to-get-the-max-out-of-your-team-coding-dojo/;17/05/2019;"Be a champion of #EgolessProgramming in #CodingDojo to bring this practice in your team. Learn more tricks in ""How to get the max out of your Team Coding Dojo ?"" https://buff.ly/2YvF1I2";17/05/2019;"Linus' Law ""Given enough eyeballs, all bugs are shallow."" also applies in randori #CodingDojo or #MobProgramming https://buff.ly/2HPitdb";17/10/18;;;;;;;;;;;;;;;;;;;;
How to learn a programming languages in just 20 hours;https://philippe.bourgau.net/how-to-learn-a-programming-language-in-just-20-hours/;20/04/2020;"I learned a lot of Haskell by just going to #CodingDojos ! Learn how to learn a new programming language in 20 hours. https://bit.ly/2zg5guN
";20/04/2020;"Thanks to its short feedback loop, #TDD plays a key role in fast #learning. ""How to learn a #programming language in just 20 hours"" https://buff.ly/2KNUS2R #DeliberatePractice";22/4/19;;;;;;;;;;;;;;;;;;;;
Why 20 hours of code kata are so effective for learning new languages;https://philippe.bourgau.net/why-20-hours-of-code-kata-are-so-effective-for-learning-new-languages/;17/06/2019;Time-boxing creates focus;17/06/2019;The more you know about software, the easier it will be to learn your next #programming language https://buff.ly/2IexIAW #DeliberatePractice #CodingDojo;21/11/2018;;;;;;;;;;;;;;;;;;;;
Frequently asked questions about the 20 hours of Code Katas;https://philippe.bourgau.net/frequently-asked-questions-about-the-20-hours-of-code-katas/;13/05/2019;The #CodingDojo was invented to teach and spread #TDD https://buff.ly/2waGp9T;22/10/2018;"For efficient learning, find a way to do #DeliberatePractice within a fast feedback loop. More tricks in ""Frequently asked questions about the 20 hours of Code Katas"" https://buff.ly/2H9Eu8H #Software #tdd ";13/5/19;;;;;;;;;;;;;;;;;;;;
Careless Mocking Considered Harmful;https://philippe.bourgau.net/careless-mocking-considered-harmful/;13/09/2019;"Mock hell : when excessive use of test mocks makes #refactoring extremely slow or difficult. Learn more in ""Careless #Mocking Considered Harmful"" https://buff.ly/2TZly0Y #testing #tdd";13/09/2019;Excessive use of #mocks leads to #LegacyCode https://buff.ly/2TZly0Y #UnitTesting #tdd ;30/11/2018;It looks like I'm not the only one who did the trip from heavy #mocking to almost no mocking at all! This path leads to super fast, maintainable and high coverage tests. https://buff.ly/1mwAf5Q https://buff.ly/2TZly0Y #TDD #UnitTesting;13/12/2018;;;;;;;;;;;;;;;;;;
How Immutable Value Objects fight Mocks;https://philippe.bourgau.net/how-immutable-value-objects-fight-mocks/;14/10/2019;Intricate #test state initialization is what encourage people to use #mocks. https://buff.ly/2QGwClC #unitTesting;1/1/2019;"Mutable state and side effects make #unitTesting less effective. Read ""How Immutable Value Objects fight Mocks"" https://buff.ly/2nx7mRn";14/10/19;;;;;;;;;;;;;;;;;;;;
Immutable Value Objects vs Mocks : Fizz Buzz;https://philippe.bourgau.net/immutable-value-objects-vs-mocks-fizz-buzz/;18/02/2020;"#Immutable Value Objects simplify #testing in many ways. Let's explore ""Immutable Value Objects vs Mocks: Fizz Buzz"" #SoftwareTesting #Software https://buff.ly/39vZ0Mc";18/02/2020;"Why is it so hard to persuade other developers to use #immutable data structures ? Open question in ""Immutable #ValueObjects vs #Mocks : Fizz Buzz"" https://buff.ly/2FHLsQk #ddd #software #unitTesting";05/04/19;;;;;;;;;;;;;;;;;;;;
How to use Test Data Builders to avoid mocks and keep your tests clear;https://philippe.bourgau.net/how-to-use-test-data-builders-to-avoid-mocks-and-keep-your-tests-clear/;18/10/2019;"If you are not careful, messy test initialization code will trick you into using #mocks. Read more in ""How to use #TestDataBuilders to avoid mocks and keep your tests clear"" https://buff.ly/32rk1oj #unitTesting #tdd #mocking";18/10/19;By simplifying the creation of new tests with different data, Test Data Builders increase code coverage in the long term!;15/1/19;@ThomasCountz Essential & Relevant: A Unit Test Balancing Act https://buff.ly/2tr9J7P. Extreme #DRY #UnitTests hurts readability. #TestDataBuilders makes things even simpler than parametrized creation methods. Easy setup test also avoids excessive #mocking https://buff.ly/2TEG85A;4/3/2019;;;;;;;;;;;;;;;;;;
How Custom Assertion Matchers will keep mocks away;https://philippe.bourgau.net/how-custom-assertion-matchers-will-keep-mocks-away/;27/01/2020;"When many different mocks are in place to isolate an external dependency, we end up with zillions versions of the code! Learn how to ""Avoid mocks and test your core domain faster with #HexagonalArchitecture"" https://buff.ly/2GlOx9H #mocking #UnitTesting";27/01/2020;"Custom assertion matchers make #refactoring easier by factorizing test assertions. More in ""How Custom Assertion Matchers will keep #mocks away"" https://buff.ly/2s946hx #softwaretesting #tdd ";14/1/20;;;;;;;;;;;;;;;;;;;;
Avoid mocks and test your core domain faster with Hexagonal Architecture;https://philippe.bourgau.net/avoid-mocks-and-test-your-core-domain-faster-with-hexagonal-architecture/;24/02/2020;"When many different #mocks are in place to isolate an external dependency, we end up with 'n' versions of the code! Read more in ""Avoid mocks and test your core domain faster with #HexagonalArchitecture"" https://buff.ly/2P9PCGx #TDD #unitTesting";24/02/2020;By keeping your tests around your core domain fast, Hexagonal Architecture increases your competitive advantage.;23/1/19;;;;;;;;;;;;;;;;;;;;
Get rid of mocking maintenance with full fledged in-memory fakes;https://philippe.bourgau.net/get-rid-of-mocking-maintenance-with-full-fledged-in-memory-fakes/;20/04/2020;Mocking is the unfortunate quick fix to slow tests. You can get rid of mocking maintenance with full fledged in-memory fakes. https://bit.ly/2yt3gPk #UnitTesting #Mocks #TDD;20/04/2020;Merciless mock hunting will improve the design of your system !;8/2/2019;;;;;;;;;;;;;;;;;;;;
When is testing using mocks still a good idea ?;https://philippe.bourgau.net/when-is-testing-using-mocks-still-a-good-idea/;20/09/2019;"By making #mocking so easy, mocking frameworks often do more harm than good. cf ""When is testing using mocks still a good idea ?"" https://buff.ly/2VGq9pq #UnitTesting #SoftwareTesting ";15/04/2019;When is testing using mocks still a good idea? Proxy mocks are as un-intrusive as mocks can be https://buff.ly/2m0Y4c6 #mocking #tdd #UnitTesting;20/9/2019;;;;;;;;;;;;;;;;;;;;
A coding dojo exercises plan towards refactoring legacy code;https://philippe.bourgau.net/a-coding-dojo-exercises-plan-towards-refactoring-legacy-code/;01/09/2019;"Test-Driven Development also teaches you what testable code looks like. See how we use it in ""A #codingDojo exercises plan towards #refactoring #legacyCode"" https://buff.ly/2BXmieU #tdd #unitTesting";01/09/2019;A mix of Coding Dojos in pairs and Mob Programming sessions is a good way to teach TDD in a Legacy Code context.;4/1/19;;;;;;;;;;;;;;;;;;;;
How to avoid unnecessary meetings (a takeaway from Devoxx France 2018);https://philippe.bourgau.net/how-to-avoid-unnecessary-meetings-a-takeaway-from-devoxx-france-2018/;27/03/2020;Even if you don't work remotely, avoiding unnecessary meetings is always a great thing! Here's a recipe for asynchronous #decisionMaking. https://buff.ly/2D1x70Y @bdelacretaz #remote #meeting ;07/09/2019;#OpenSource asynchronous and #remotework #DecisionMaking using git pull requests is a perfect match for #ArchitectureDecisionRecords and #LivingDocumentation https://buff.ly/2D1x70Y;14/1/19;Wondering how to make decisions in #remoteWork without spending your life with a headset on? Have a look at this Takeaway from @DevoxxFR where @bdelacretaz explains how to make decision asynchronously https://buff.ly/39lZaoO;27/3/20;;;;;;;;;;;;;;;;;;
How to convince your business to sponsor a large scale refactoring;https://philippe.bourgau.net/how-to-convince-your-business-to-sponsor-a-large-scale-refactoring/;29/11/2019;"Is Diogenes syndrome for source code a recognized pathology? Let's see ""How to convince your business of sponsoring a large scale #refactoring"" #LegacyCode #CleanCode https://buff.ly/34rfbrX";29/11/2019;"How to convince your business to sponsor a large scale #refactoring? Stating @DocOnDev ""We should never ask the permission to do a good job"" https://buff.ly/2YkW3cK Read more: https://buff.ly/2U3ybef";27/3/19;;;;;;;;;;;;;;;;;;;;
Why we need Badass developers to perform large scale refactorings;https://philippe.bourgau.net/why-we-need-badass-developers-to-perform-large-scale-refactorings/;06/12/2019;"Badass developers are first of all people who are credible to the business. This is ""Why we need Badass developers to perform large scale #refactorings"" https://buff.ly/388aYMc #LegacyCode";06/12/2019;On my first job, I tried to make the point for TDD with by giving a good live coding demo. But it was this respected developer's opinion that won the point.;6/3/2019;;;;;;;;;;;;;;;;;;;;
5 mistakes badass developers never do;https://philippe.bourgau.net/5-mistakes-badass-developers-never-do/;13/01/2020;"A badass developer will not add a funky new tech in the production code. This is one of ""5 mistakes #badassdevelopers never do"" https://philippe.bourgau.net/5-mistakes-badass-developers-never-do/ #SoftwareDeveloper ";13/01/2020;"At @DDDesignFR @ericevans0 said ""Some of my biggest mistakes were not backtracking soon enough a few times as I was drifting in quagmire"". Find other advices in ""5 mistakes #BadassDeveloper never do"" https://buff.ly/2V6kf3I";19/4/2019;;;;;;;;;;;;;;;;;;;;
Principles that will make you become a badass developer;https://philippe.bourgau.net/principles-that-will-make-you-become-a-badass-developer/;16/09/2019;"Candor is a way to get our opinions and questions through, without sounding rude or pushy. More tactics in ""Principles that will make you become a #badassDeveloper"" https://buff.ly/32zeziF #refactoring #SoftwareEngineer ";16/09/2019;In the end, #BadassDevelopers are ready to leave a FUBARed situation https://buff.ly/2zS6TyG;25/9/18;;;;;;;;;;;;;;;;;;;;
Incremental Software Development for Large Scale Refactorings;https://philippe.bourgau.net/incremental-software-development-techniques-for-large-scale-refactorings/;24/01/2020;"Incremental #software development fixes the business people's fear of #refactoring tunnel. Read more in ""Incremental Software Development for Large Scale Refactorings"" https://buff.ly/2Gkll2I";24/01/2020;"Mastering incremental #softwareDevelopment builds self-confidence for developers. Read more in ""Incremental Software Development for Large Scale #Refactorings""  https://buff.ly/2UAljxu #eXtremeProgramming";12/4/2019;;;;;;;;;;;;;;;;;;;;
Incremental Software Development Strategies for Large Scale Refactoring #1 : Constant Merciless Refactoring;https://philippe.bourgau.net/incremental-software-development-strategies-for-large-scale-refactoring-number-1-constant-merciless-refactoring/;11/10/2019;"The easiest #refactorings to negotiate are the ones we don't have to talk about ! ""Incremental #Software Development Strategies for Large Scale Refactoring #1 : Constant #MercilessRefactoring"" https://buff.ly/2Up6NEx #eXtremeProgramming #IncrementalDesign";13/03/2019;"""Disguise"" #refactoring as the first technical sub-task of a feature to get it prioritized. https://buff.ly/32cWWWp #softwaredevelopment ";11/10/2019;;;;;;;;;;;;;;;;;;;;
Incremental Software Development Strategies for Large Scale Refactoring #2 : Baby Steps;https://philippe.bourgau.net/incremental-software-development-strategies-for-large-scale-refactoring-number-2-baby-steps/;03/04/2019;TDD has a baby steps rythm baked in.;19/09/2018;"The #MikadoMethod is at the heart of making baby steps work in real life ""Incremental #SoftwareDevelopment Strategies for Large Scale #Refactoring part 2 : Baby Steps"" https://buff.ly/2FH7nsq";3/4/2019;;;;;;;;;;;;;;;;;;;;
Incremental Software Development Strategies for Large Scale Refactoring #3 : Organize it !;https://philippe.bourgau.net/incremental-software-development-strategies-for-large-scale-refactoring-number-3-manage-it/;10/01/2020;"A key benefit of mikado graphs is that we can stick them on the wall for everyone to know where we stand in a #refactoring. ""Incremental Software Development Strategies for Large Scale Refactoring #3 : Manage it !"" https://buff.ly/2PydpOS #MikadoMethod #VisualManagement ";19/03/2019;"Keeping a #WorkInProgress limit on #refactorings is essential. Read more tips to self-organize around team refactoring efforts in ""Incremental Software Development Strategies for Large Scale Refactoring"" https://buff.ly/2tHrHWS #softwaredevelopment #SoftwareCraftsmanship";10/1/2020;;;;;;;;;;;;;;;;;;;;
Incremental Software Development Strategies for Large Scale Refactoring #4 : a Pattern Language;https://philippe.bourgau.net/incremental-software-development-strategies-for-large-scale-refactoring-number-4-a-pattern-language/;15/05/2019;"Incremental #refactoring is not only about baby steps, it's also about early value delivery ! ""Incremental Software Development Strategies for Large Scale Refactoring part 4 : a #Pattern Language"" https://buff.ly/2PR5lt9 #Software #XP";15/05/2019;Feature toggles are painful, but branches are worse ! https://buff.ly/2wqqphm #refactoring #patterns ;8/11/2018;;;;;;;;;;;;;;;;;;;;
Presenting a large scale refactoring as a business opportunity;https://philippe.bourgau.net/presenting-a-large-scale-refactoring-as-a-business-opportunity/;20/05/2019;Mastering pitch is a great first step for developers who want to get sponsorship for a #refactoring. https://buff.ly/2MOuxCa #Pitch #Software ;24/10/2018;"In many cases, an expectation of less bugs and more features is what gets a #refactoring prioritized. ""Presenting a large scale refactoring as a business opportunity""  https://buff.ly/2JoKooM";20/5/2019;;;;;;;;;;;;;;;;;;;;
5 Effective warning signals to get sponsorship for a large scale refactoring;https://philippe.bourgau.net/effective-warning-signals-to-get-sponsorship-for-a-large-scale-refactoring/;20/11/2018;A disease might be a better metaphor than #TechnicalDebt for #CodeCruft. https://buff.ly/2NbGUIM;20/11/2018;The Therac-25 (a radiation therapy machine) killed 6 people because it was difficult to perform automated tests !;;;;;;;;;;;;;;;;;;;;;
Making the business case for a large scale refactoring - Part 1;https://philippe.bourgau.net/making-the-business-case-for-a-large-scale-refactoring-part-1/;14/06/2019;"We must detail precisely what #refactoring we want before making a #businessCase for it. Read more in ""Making the business case for a large scale refactoring"" https://buff.ly/2MKpy64 #LegacyCode";14/06/2019;The cost of not doing a #refactoring is the sum of all the waste work generated by the current code. https://buff.ly/2QKvWIm #BusinessCase #TechnicalDebt #programming ;28/11/18;;;;;;;;;;;;;;;;;;;;
