Post;Url;Last tweet date;Nugget 1;Nugget 1 tweet date;Nugget 2;Nugget 2 tweet date;Nugget 3;Nugget 3 tweet date;Nugget 4;Nugget 4 tweet date;Nugget 5;Nugget 5 tweet date;Nugget 6 ;Nugget 6 tweet date;Nugget 7;Nugget 7 tweet date;Nugget 8;Nugget 8 tweet date;Nugget 9;Nugget 9 tweet date;;;;;;
Why 20 hours of code kata are so effective for learning new languages,https://philippe.bourgau.net/why-20-hours-of-code-kata-are-so-effective-for-learning-new-languages/,17/06/2019,Time-boxing creates focus,17/06/2019,"The more you know about software, the easier it will be to learn your next #programming language https://bit.ly/35RJMQV #DeliberatePractice #CodingDojo",21/11/2018,,,,,,,,,,,,,,,,,,,,
Frequently asked questions about the 20 hours of Code Katas,https://philippe.bourgau.net/frequently-asked-questions-about-the-20-hours-of-code-katas/,13/05/2019,The #CodingDojo was invented to teach and spread #TDD https://bit.ly/2SWUjoK,22/10/2018,"For efficient learning, find a way to do #DeliberatePractice within a fast feedback loop. More tricks in ""Frequently asked questions about the 20 hours of Code Katas"" https://bit.ly/2SWUjoK #Software #tdd ",13/5/19,,,,,,,,,,,,,,,,,,,,
Careless Mocking Considered Harmful,https://philippe.bourgau.net/careless-mocking-considered-harmful/,13/09/2019,"Mock hell : when excessive use of test mocks makes #refactoring extremely slow or difficult. Learn more in ""Careless #Mocking Considered Harmful"" https://bit.ly/2WlgqHx #testing #tdd",13/09/2019,Excessive use of #mocks leads to #LegacyCode https://bit.ly/2WlgqHx #UnitTesting #tdd ,30/11/2018,"It looks like I'm not the only one who did the trip from heavy #mocking to almost no mocking at all! This path leads to super fast, maintainable and high coverage tests. https://bit.ly/2WlgqHx https://bit.ly/2WlgqHx #TDD #UnitTesting",13/12/2018,,,,,,,,,,,,,,,,,,
How Immutable Value Objects fight Mocks,https://philippe.bourgau.net/how-immutable-value-objects-fight-mocks/,14/10/2019,Intricate #test state initialization is what encourage people to use #mocks. https://bit.ly/35MUkRB #unitTesting,1/1/2019,"Mutable state and side effects make #unitTesting less effective. Read ""How Immutable Value Objects fight Mocks"" https://bit.ly/35MUkRB",14/10/19,,,,,,,,,,,,,,,,,,,,
Immutable Value Objects vs Mocks : Fizz Buzz,https://philippe.bourgau.net/immutable-value-objects-vs-mocks-fizz-buzz/,18/02/2020,"#Immutable Value Objects simplify #testing in many ways. Let's explore ""Immutable Value Objects vs Mocks: Fizz Buzz"" #SoftwareTesting #Software https://bit.ly/3bozucr",18/02/2020,"Why is it so hard to persuade other developers to use #immutable data structures ? Open question in ""Immutable #ValueObjects vs #Mocks : Fizz Buzz"" https://bit.ly/3bozucr #ddd #software #unitTesting",05/04/19,,,,,,,,,,,,,,,,,,,,
How to use Test Data Builders to avoid mocks and keep your tests clear,https://philippe.bourgau.net/how-to-use-test-data-builders-to-avoid-mocks-and-keep-your-tests-clear/,18/10/2019,"If you are not careful, messy test initialization code will trick you into using #mocks. Read more in ""How to use #TestDataBuilders to avoid mocks and keep your tests clear"" https://bit.ly/2zpAG1Z #unitTesting #tdd #mocking",18/10/19,"By simplifying the creation of new tests with different data, Test Data Builders increase code coverage in the long term!",15/1/19,@ThomasCountz Essential & Relevant: A Unit Test Balancing Act https://bit.ly/2zpAG1Z. Extreme #DRY #UnitTests hurts readability. #TestDataBuilders makes things even simpler than parametrized creation methods. Easy setup test also avoids excessive #mocking https://bit.ly/2zpAG1Z,4/3/2019,,,,,,,,,,,,,,,,,,
How Custom Assertion Matchers will keep mocks away,https://philippe.bourgau.net/how-custom-assertion-matchers-will-keep-mocks-away/,27/01/2020,"When many different mocks are in place to isolate an external dependency, we end up with zillions versions of the code! Learn how to ""Avoid mocks and test your core domain faster with #HexagonalArchitecture"" https://bit.ly/2WMhIdJ #mocking #UnitTesting",27/01/2020,"Custom assertion matchers make #refactoring easier by factorizing test assertions. More in ""How Custom Assertion Matchers will keep #mocks away"" https://bit.ly/2WMhIdJ #softwaretesting #tdd ",14/1/20,,,,,,,,,,,,,,,,,,,,
Avoid mocks and test your core domain faster with Hexagonal Architecture,https://philippe.bourgau.net/avoid-mocks-and-test-your-core-domain-faster-with-hexagonal-architecture/,24/02/2020,"When many different #mocks are in place to isolate an external dependency, we end up with 'n' versions of the code! Read more in ""Avoid mocks and test your core domain faster with #HexagonalArchitecture"" https://bit.ly/2Wkym56 #TDD #unitTesting",24/02/2020,"By keeping your tests around your core domain fast, Hexagonal Architecture increases your competitive advantage.",23/1/19,,,,,,,,,,,,,,,,,,,,
Get rid of mocking maintenance with full fledged in-memory fakes,https://philippe.bourgau.net/get-rid-of-mocking-maintenance-with-full-fledged-in-memory-fakes/,20/04/2020,Mocking is the unfortunate quick fix to slow tests. You can get rid of mocking maintenance with full fledged in-memory fakes. https://bit.ly/2yt3gPk #UnitTesting #Mocks #TDD,20/04/2020,Merciless mock hunting will improve the design of your system !,8/2/2019,,,,,,,,,,,,,,,,,,,,
When is testing using mocks still a good idea ?,https://philippe.bourgau.net/when-is-testing-using-mocks-still-a-good-idea/,20/09/2019,"By making #mocking so easy, mocking frameworks often do more harm than good. cf ""When is testing using mocks still a good idea ?"" https://bit.ly/2WJMDHH #UnitTesting #SoftwareTesting ",15/04/2019,When is testing using mocks still a good idea? Proxy mocks are as un-intrusive as mocks can be https://bit.ly/2WJMDHH #mocking #tdd #UnitTesting,20/9/2019,,,,,,,,,,,,,,,,,,,,
A coding dojo exercises plan towards refactoring legacy code,https://philippe.bourgau.net/a-coding-dojo-exercises-plan-towards-refactoring-legacy-code/,01/09/2019,"Test-Driven Development also teaches you what testable code looks like. See how we use it in ""A #codingDojo exercises plan towards #refactoring #legacyCode"" https://bit.ly/2yLtZHr #tdd #unitTesting",01/09/2019,A mix of Coding Dojos in pairs and Mob Programming sessions is a good way to teach TDD in a Legacy Code context.,4/1/19,,,,,,,,,,,,,,,,,,,,
How to avoid unnecessary meetings (a takeaway from Devoxx France 2018),https://philippe.bourgau.net/how-to-avoid-unnecessary-meetings-a-takeaway-from-devoxx-france-2018/,27/03/2020,"Even if you don't work remotely, avoiding unnecessary meetings is always a great thing! Here's a recipe for asynchronous #decisionMaking. https://bit.ly/2Wngk29 @bdelacretaz #remote #meeting ",07/09/2019,#OpenSource asynchronous and #remotework #DecisionMaking using git pull requests is a perfect match for #ArchitectureDecisionRecords and #LivingDocumentation https://bit.ly/2Wngk29,14/1/19,Wondering how to make decisions in #remoteWork without spending your life with a headset on? Have a look at this Takeaway from @DevoxxFR where @bdelacretaz explains how to make decision asynchronously https://bit.ly/2Wngk29,27/3/20,,,,,,,,,,,,,,,,,,
How to convince your business to sponsor a large scale refactoring,https://philippe.bourgau.net/how-to-convince-your-business-to-sponsor-a-large-scale-refactoring/,29/11/2019,"Is Diogenes syndrome for source code a recognized pathology? Let's see ""How to convince your business of sponsoring a large scale #refactoring"" #LegacyCode #CleanCode https://bit.ly/3fEdrBJ",29/11/2019,"How to convince your business to sponsor a large scale #refactoring? Stating @DocOnDev ""We should never ask the permission to do a good job"" https://bit.ly/3fEdrBJ Read more: https://bit.ly/3fEdrBJ",27/3/19,,,,,,,,,,,,,,,,,,,,
Why we need Badass developers to perform large scale refactorings,https://philippe.bourgau.net/why-we-need-badass-developers-to-perform-large-scale-refactorings/,06/12/2019,"Badass developers are first of all people who are credible to the business. This is ""Why we need Badass developers to perform large scale #refactorings"" https://bit.ly/35PU1Fr #LegacyCode",06/12/2019,"On my first job, I tried to make the point for TDD with by giving a good live coding demo. But it was this respected developer's opinion that won the point.",6/3/2019,,,,,,,,,,,,,,,,,,,,
5 mistakes badass developers never do,https://philippe.bourgau.net/5-mistakes-badass-developers-never-do/,13/01/2020,"A badass developer will not add a funky new tech in the production code. This is one of ""5 mistakes #badassdevelopers never do"" https://bit.ly/2WntjkI #SoftwareDeveloper ",13/01/2020,"At @DDDesignFR @ericevans0 said ""Some of my biggest mistakes were not backtracking soon enough a few times as I was drifting in quagmire"". Find other advices in ""5 mistakes #BadassDeveloper never do"" https://bit.ly/2WntjkI",19/4/2019,,,,,,,,,,,,,,,,,,,,
Principles that will make you become a badass developer,https://philippe.bourgau.net/principles-that-will-make-you-become-a-badass-developer/,16/09/2019,"Candor is a way to get our opinions and questions through, without sounding rude or pushy. More tactics in ""Principles that will make you become a #badassDeveloper"" https://bit.ly/3bhRJjC #refactoring #SoftwareEngineer ",16/09/2019,"In the end, #BadassDevelopers are ready to leave a FUBARed situation https://bit.ly/3bhRJjC",25/9/18,,,,,,,,,,,,,,,,,,,,
Incremental Software Development for Large Scale Refactorings,https://philippe.bourgau.net/incremental-software-development-techniques-for-large-scale-refactorings/,24/01/2020,"Incremental #software development fixes the business people's fear of #refactoring tunnel. Read more in ""Incremental Software Development for Large Scale Refactorings"" https://bit.ly/3dEWMMJ",24/01/2020,"Mastering incremental #softwareDevelopment builds self-confidence for developers. Read more in ""Incremental Software Development for Large Scale #Refactorings""  https://bit.ly/3dEWMMJ #eXtremeProgramming",12/4/2019,,,,,,,,,,,,,,,,,,,,
Incremental Software Development Strategies for Large Scale Refactoring #1 : Constant Merciless Refactoring,https://philippe.bourgau.net/incremental-software-development-strategies-for-large-scale-refactoring-number-1-constant-merciless-refactoring/,11/10/2019,"The easiest #refactorings to negotiate are the ones we don't have to talk about ! ""Incremental #Software Development Strategies for Large Scale Refactoring #1 : Constant #MercilessRefactoring"" https://bit.ly/2LhClZQ #eXtremeProgramming #IncrementalDesign",13/03/2019,"""Disguise"" #refactoring as the first technical sub-task of a feature to get it prioritized. https://bit.ly/2LhClZQ #softwaredevelopment ",11/10/2019,,,,,,,,,,,,,,,,,,,,
Incremental Software Development Strategies for Large Scale Refactoring #2 : Baby Steps,https://philippe.bourgau.net/incremental-software-development-strategies-for-large-scale-refactoring-number-2-baby-steps/,03/04/2019,TDD has a baby steps rythm baked in.,19/09/2018,"The #MikadoMethod is at the heart of making baby steps work in real life ""Incremental #SoftwareDevelopment Strategies for Large Scale #Refactoring part 2 : Baby Steps"" https://bit.ly/2YTYgOQ",3/4/2019,,,,,,,,,,,,,,,,,,,,
Incremental Software Development Strategies for Large Scale Refactoring #3 : Organize it !,https://philippe.bourgau.net/incremental-software-development-strategies-for-large-scale-refactoring-number-3-manage-it/,10/01/2020,"A key benefit of mikado graphs is that we can stick them on the wall for everyone to know where we stand in a #refactoring. ""Incremental Software Development Strategies for Large Scale Refactoring #3 : Manage it !"" https://bit.ly/2WkfLX2 #MikadoMethod #VisualManagement ",19/03/2019,"Keeping a #WorkInProgress limit on #refactorings is essential. Read more tips to self-organize around team refactoring efforts in ""Incremental Software Development Strategies for Large Scale Refactoring"" https://bit.ly/2WkfLX2 #softwaredevelopment #SoftwareCraftsmanship",10/1/2020,,,,,,,,,,,,,,,,,,,,
Incremental Software Development Strategies for Large Scale Refactoring #4 : a Pattern Language,https://philippe.bourgau.net/incremental-software-development-strategies-for-large-scale-refactoring-number-4-a-pattern-language/,15/05/2019,"Incremental #refactoring is not only about baby steps, it's also about early value delivery ! ""Incremental Software Development Strategies for Large Scale Refactoring part 4 : a #Pattern Language"" https://bit.ly/3bmidAs #Software #XP",15/05/2019,"Feature toggles are painful, but branches are worse ! https://bit.ly/3bmidAs #refactoring #patterns ",8/11/2018,,,,,,,,,,,,,,,,,,,,
Presenting a large scale refactoring as a business opportunity,https://philippe.bourgau.net/presenting-a-large-scale-refactoring-as-a-business-opportunity/,20/05/2019,Mastering pitch is a great first step for developers who want to get sponsorship for a #refactoring. https://bit.ly/3dDaj7c #Pitch #Software ,24/10/2018,"In many cases, an expectation of less bugs and more features is what gets a #refactoring prioritized. ""Presenting a large scale refactoring as a business opportunity""  https://bit.ly/3dDaj7c",20/5/2019,,,,,,,,,,,,,,,,,,,,
5 Effective warning signals to get sponsorship for a large scale refactoring,https://philippe.bourgau.net/effective-warning-signals-to-get-sponsorship-for-a-large-scale-refactoring/,20/11/2018,A disease might be a better metaphor than #TechnicalDebt for #CodeCruft. https://bit.ly/2xSs2IR,20/11/2018,The Therac-25 (a radiation therapy machine) killed 6 people because it was difficult to perform automated tests !,,,,,,,,,,,,,,,,,,,,,
Making the business case for a large scale refactoring - Part 1,https://philippe.bourgau.net/making-the-business-case-for-a-large-scale-refactoring-part-1/,14/06/2019,"We must detail precisely what #refactoring we want before making a #businessCase for it. Read more in ""Making the business case for a large scale refactoring"" https://bit.ly/3cpjcRF #LegacyCode",14/06/2019,The cost of not doing a #refactoring is the sum of all the waste work generated by the current code. https://bit.ly/3cpjcRF #BusinessCase #TechnicalDebt #programming ,28/11/18,,,,,,,,,,,,,,,,,,,,
Making the business case for a large scale refactoring - Part 2,https://philippe.bourgau.net/become-a-business-partner-and-stop-begging-for-refactoring/,09/07/2019,"The longer the life expectancy of your product, the more #refactoring you should invest in! https://bit.ly/3ctIqPa #programming #software #TechnicalDebt",19/12/2018,Avoiding bad moves is a key benefit of making a business case for large scale refactoring!,9/7/2019,,,,,,,,,,,,,,,,,,,,
Become a Business Partner and Stop Begging for Refactoring,https://philippe.bourgau.net/become-a-business-partner-and-stop-begging-for-refactoring/,10/09/2019,"Decentralized decision rules are agreed once, but used many times, without involving management. https://bit.ly/3ctIqPa #lpd2 #SelfOrganization",13/12/2018,"Becoming a business partners lets developers have a permanent #refactoring bandwidth.""Become a Business Partner and Stop Begging for Refactoring""  https://bit.ly/3ctIqPa #BDD",10/9/2019,,,,,,,,,,,,,,,,,,,,
How to maintain a business partnership about refactoring?,https://philippe.bourgau.net/how-to-maintain-a-business-partnership-about-refactoring/,24/09/2019,Timeboxing #refactoring with 'x team members full time' is a lot easier to do than with typical time constraints. https://bit.ly/2zwqvZy #Software ,02/01/2019,"Use data to spot the best #refactoring to work on. That's one of the things to do to ""Maintain a business partnership about refactoring?"" https://bit.ly/2zwqvZy",24/9/2019,,,,,,,,,,,,,,,,,,,,
The unexpected contributions to a productivity increase by 25% of a fruit basket at work,https://philippe.bourgau.net/how-we-increased-productivity-by-25-with-a-fruit-basket-at-work/,04/09/2019,Read about an unexpected 25% productivity boost for 30 minutes of weekly fruit management! A story about #complexity in the modern workplace. https://bit.ly/3conWHs,04/09/2019,"In a complex world, nothing is straightforward. Things only appear to make sense after the fact.",16/1/19,,,,,,,,,,,,,,,,,,,,
The best 10 seconds I spent on my Kanban board setup,https://philippe.bourgau.net/its-time-to-flip-your-kanban-board-setup/,30/09/2019,What's the first thing I see when I open my kanban board: TODO items! Time to flip the board,18/01/2019,"Inverting #Kanban board columns contributes to a more #sustainablePace! Read about ""The best 10 seconds I spent on my Kanban board setup"" https://bit.ly/35PZH2g",30/09/2019,,,,,,,,,,,,,,,,,,,,
Vertical Kanban Board Setups,https://philippe.bourgau.net/vertical-kanban-board-setup/,08/09/2019,We need to adapt Kanban boards according to people's cultures.,30/01/2019,"#Kanban boards: Could we replace these sad, sterile and mechanic #process tools with something more humane? Let's try ""Vertical Kanban Board Setups"" https://bit.ly/3fDyS62 #scrum ",8/9/2019,,,,,,,,,,,,,,,,,,,,
Misadventures with Big Design Up Front,https://philippe.bourgau.net/misadventures-with-big-design-up-front/,05/11/2019,"At school, we were tought to write all pseudo code on paper before touching the keyboard at all!",05/02/2019,"Very often, people eventually capitulate to a design to end the painful #BigDesignUpFront process! Read more ""Misadventures with #BDUF"" here, and discover an alternative way! https://bit.ly/2zr8dIX #EventStorming #DDD",5/11/2019,,,,,,,,,,,,,,,,,,,,
How I learned to do Big Design Up Front in 2 days of Event Storming,https://philippe.bourgau.net/how-to-squash-big-design-up-front-in-a-few-days-with-event-storming/,13/11/2019,We cannot achieve a sustainable pace without incremental design!,13/02/2019,"Having a shared vision helps everyone in the team to know how to refactor the code at any moment. ""How I learned to do Big Design Up Front in 2 days of #EventStorming"" https://bit.ly/2WkfNhC #refactoring #DDD",13/11/2019,,,,,,,,,,,,,,,,,,,,
How to prepare a DDD Big Picture Event Storming workshop,https://philippe.bourgau.net/how-to-prepare-a-ddd-big-picture-event-storming-workshop/,19/11/2019,"Alexander Graham Bell could have thought of DDD Event Storming when he said ""Before anything, preparation is the key to success.""",20/02/2019,"Once everyone knows enough about the problem domain, they work better together. Learn ""How to prepare a #DDD Big Picture #EventStorming workshop"" https://bit.ly/2Am3sB7 #CollectiveIntelligence",19/11/2019,,,,,,,,,,,,,,,,,,,,
How to prepare the room for a DDD Big Picture Event Storming,https://philippe.bourgau.net/how-to-prepare-the-room-for-a-ddd-big-picture-event-storming/,03/12/2019,"A Visual Agenda will reassure first time attendees of DDD Event Storming, which can be a rather chaotic workshop.",05/03/2019,"I beg you to bring food to avoid #DeathByEventStorming #EventStorming. Read more down-to-earth tips in ""How to prepare the room for a #DDD Big Picture Event Storming"" https://bit.ly/2LicLnR",3/12/2019,,,,,,,,,,,,,,,,,,,,
Detailed Agenda of a DDD Big Picture Event Storming - Part 1,https://philippe.bourgau.net/detailed-agenda-of-a-ddd-big-picture-event-storming-part-1/,21/01/2020,"At the end of the day, the success of an #EventStorming is all about how much participants want it! Learn how to run your own session in ""Detailed Agenda of a #DDD Big Picture Event Storming"" https://bit.ly/3blSWXf #softwaredevelopment ",17/09/2019,"I've seen #EventStorming sessions drifting into technical discussions, this leads nowhere. Learn more about ""Detailed Agenda of a #DDD Big Picture Event Storming"" https://bit.ly/3blSWXf",21/01/2020,"@Boldarecom Just read your #EventStorming guide https://bit.ly/3blSWXf. I like your idea to ask to read @ziobrando introductory post. Instead of introducing commands, I ask people to sort the events to get them to discuss and collaborate. Full story here https://bit.ly/3blSWXf",01/03/2019,,,,,,,,,,,,,,,,,,
Detailed Agenda of a DDD Big Picture Event Storming - Part 2,https://philippe.bourgau.net/detailed-agenda-of-a-ddd-big-picture-event-storming-part-2/,10/12/2019,"@ziobrando 's trick: ignite the #EventStorming by sticking a prepared domain event on the design board. Here is my ""Detailed Agenda of a #DDD Big Picture Event Storming"" https://bit.ly/2YU7Q4u",10/12/2019,"#EventStorming does its magic when people try to sort all their domain events. ""Detailed Agenda of a #DDD Big Picture Event Storming - Part 2"" https://bit.ly/2YU7Q4u",20/3/2019,,,,,,,,,,,,,,,,,,,,
Detailed Agenda of a DDD Big Picture Event Storming - Part 3,https://philippe.bourgau.net/detailed-agenda-of-a-ddd-big-picture-event-storming-part-3/,28/01/2020,"By far the biggest outcome of #DDD Big Picture #EventStorming is a better shared understanding of the domain. Learn more in ""Detailed Agenda of a DDD Big Picture Event Storming"" https://bit.ly/35Nuw7I #Software #SoftwareArchitecture",10/04/2019,"#EventStorming unlocks drafting an architecture, drawing teams, and a sustainable #refactoring path. Have a look at ""Detailed Agenda of a #DDD Big Picture Event Storming "" https://bit.ly/35Nuw7I",28/01/2020,,,,,,,,,,,,,,,,,,,,
4 tips that will make your DDD Big Picture Event Storming successful,https://philippe.bourgau.net/4-tips-that-will-make-your-ddd-big-picture-event-storming-successful/,04/02/2020,"I found that a double #pomodoro is the most productive and sustainable time schedule for a #DDD #EventStorming. This is 1 of ""4 tips that will make your DDD Big Picture Event Storming successful"" https://bit.ly/2WMG07j",17/04/2019,"If you don't have real domain experts, assign business roles for #DDD #EventStorming. This is one of ""4 tips that will make your DDD Big Picture Event Storming successful"" https://bit.ly/2WMG07j #SoftwareEngineering ",04/02/2020,"For legacy refactoring, run DDD Event Storming as if you were starting from scratch",,,,,,,,,,,,,,,,,,,
Drafting a Functional Architecture Vision with Event Storming and DDD,https://philippe.bourgau.net/drafting-a-functional-architecture-vision-with-ddd-event-storming-part-1/,06/02/2020,"#BoundedContexts are the most important part of #DDD. Maintaining a strong decoupling between different functional areas makes #largeSystems more simple. Learn more in ""Drafting a Functional #Architecture Vision with #EventStorming and DDD"" https://bit.ly/2WNzgpQ",24/04/2019,"Wool, scissors and adhesive tape is all you need to draw functional areas on an DDD Event Storming design board.",06/02/2020,,,,,,,,,,,,,,,,,,,,
Build or Buy Software? Identify your core functional areas with Event Storming and DDD,https://philippe.bourgau.net/build-or-buy-software-identify-your-core-functional-areas-with-event-storming-and-ddd/,25/02/2020,"#EventStorming and #DDD can help us to identify where to focus. More in ""Build or Buy? Identify your core #boundedContexts with Event Storming and DDD"" https://bit.ly/2YDrZvz",01/05/2019,"Use #EventStorming and #DDD to identify generic parts of your system. Then save time by replacing them with third parties. ""Build or Buy Software? Identify your core bounded contexts with Event Storming and DDD"" https://bit.ly/2YDrZvz",25/02/2020,,,,,,,,,,,,,,,,,,,,
Check that core areas have the upper hand with Event Storming and DDD,https://philippe.bourgau.net/check-that-core-areas-have-the-upper-hand-with-event-storming-and-ddd/,14/05/2019,"Upstream bounded contexts enjoy more focus, prioritization, quality and investment... at the cost of other contexts.",,"Moving to an upstream team might be the quickest way to find a more #sustainablepace! Learn more about upstream #boundedcontext in ""Ensure core contexts have the upper hand with #EventStorming and #DDD"" https://bit.ly/2xR5ecj",14/5/2019,,,,,,,,,,,,,,,,,,,,
Focus on Core Domain with Relationships from DDD and Event Storming - part 1,https://philippe.bourgau.net/focus-on-core-domain-with-relationships-from-ddd-and-event-storming/,21/05/2019,"Focusing on #coredomain is the key to long term profitable and #sustainablepace. ""Focus on the Core with #EventStorming and #DDD Domain Relationships"" https://bit.ly/2WkyykQ",21/05/2019,"DDD can seem too abstract, use Event Storming to present it with storytelling.",,,,,,,,,,,,,,,,,,,,,
Focus on Core Domain with Relationships from DDD and Event Storming - part 2,https://philippe.bourgau.net/focus-on-core-domain-with-relationships-from-ddd-and-event-storming-part-2/,28/05/2019,DDD is like the fight club. Don’t speak of DDD.,,"#ContextMapping with #DDD and #EventStorming helps to avoid a tangle of #mocks. ""Focus on the Core with Event Storming and DDD Domain Relationships"" https://bit.ly/3dvpqQ4",28/5/2019,,,,,,,,,,,,,,,,,,,,
How to use Event Storming and DDD for evolutionary architecture,https://philippe.bourgau.net/how-to-use-event-storming-and-ddd-for-evolutionary-architecture/,05/06/2019,The trick is to make things as simple as possible at the beginning while keeping the ability to refactor.,,"By documenting past decisions, #LivingDocumentation let us change the system later down the road. ""How to use #EventStorming and #DDD for Evolutionary #Architecture"" https://bit.ly/2WkfXFK",5/6/2019,,,,,,,,,,,,,,,,,,,,
Using Event Storming and DDD to prototype (micro)services and NFRs - 1,https://philippe.bourgau.net/using-event-storming-and-ddd-to-prototype-microservices-and-nfrs-1/,20/04/2020,"Late discoveries of #NFR problems leads to crunch hours and non #sustainablePace. Read about ""Using #EventStorming and #DDD to prototype #microservices and NFRs"" https://bit.ly/2Klzizz",12/06/2019,"Use wool, scissors and scotch tape to materialize services on your #EventStorming board. https://bit.ly/2Klzizz #MicroServices",20/04/2020,,,,,,,,,,,,,,,,,,,,
